{
  "contract_version": "academy-session/v1",
  "academy_version": "Academy Experience v5",
  "lab_name": "greenplum-partitioning",
  "student_name": "Demo Student",
  "created_at": "2026-06-14T10:00:00",
  "current_stage": {
    "code": "partition-pruning",
    "title": "Partition pruning and retention",
    "timebox": "10:00-25:00",
    "mentor_focus": "Показать bad/good partition key и объяснить, что pruning/retention не заменяют DISTRIBUTED BY.",
    "student_action": "Запустить SQL-lab и показать EXPLAIN pruning.",
    "command": "python3 mentor-lab.py runbook greenplum-partitioning simple"
  },
  "stages": [
    {
      "code": "replay",
      "title": "Replay evidence from Lesson 01",
      "timebox": "00:00-10:00",
      "mentor_focus": "Проверить, что ученик принес EXPLAIN, gp_segment_id и validation evidence.",
      "student_action": "Назвать один evidence gap и его влияние на partitioning decision.",
      "command": "python3 mentor-lab.py replay greenplum --student Иван --submission submissions/query-tuning.md --pre 40 --post 85 --output artifacts/greenplum-replay.md"
    },
    {
      "code": "partition-pruning",
      "title": "Partition pruning and retention",
      "timebox": "10:00-25:00",
      "mentor_focus": "Показать bad/good partition key и объяснить, что pruning/retention не заменяют DISTRIBUTED BY.",
      "student_action": "Запустить SQL-lab и показать EXPLAIN pruning.",
      "command": "python3 mentor-lab.py runbook greenplum-partitioning simple"
    },
    {
      "code": "statistics",
      "title": "Statistics after incremental load",
      "timebox": "25:00-40:00",
      "mentor_focus": "Связать incremental load с optimizer contract и свежей статистикой.",
      "student_action": "Показать last_analyze и объяснить риск stale statistics.",
      "command": "ANALYZE lesson02.fact_sales_partitioned;"
    }
  ],
  "skill_graph": [
    {
      "code": "partition-pruning",
      "title": "Partition pruning",
      "level": "core",
      "evidence": "Ученик показывает EXPLAIN, где отсекаются partitions."
    },
    {
      "code": "statistics",
      "title": "Statistics after load",
      "level": "core",
      "evidence": "Ученик связывает ANALYZE с выбором join/Motion pattern."
    }
  ],
  "commands": [
    "python3 mentor-lab.py lesson-release greenplum-partitioning verify",
    "python3 mentor-lab.py runbook greenplum-partitioning simple",
    "python3 mentor-lab.py session greenplum-partitioning report --session artifacts/sessions/demo --output artifacts/lesson02-session-report.md"
  ],
  "events": [],
  "control_plane": {
    "version": "academy-control-plane/v1",
    "mentor_mode": {
      "default_route": "simple",
      "runbook_commands": [
        "python3 mentor-lab.py runbook greenplum-partitioning simple",
        "python3 mentor-lab.py runbook greenplum-partitioning deep",
        "python3 mentor-lab.py runbook greenplum-partitioning homework"
      ],
      "slide_deck": "artifacts/greenplum-partitioning-theory.pptx",
      "google_slides": "https://docs.google.com/presentation/d/17Ae88PoniaFU34egsFPwC0PndAOoXMze4qV1pIKQkaI/edit?usp=sharing",
      "stage_guides": [
        {
          "stage_code": "replay",
          "slides": "1-3",
          "mentor_script": "Начни с replay evidence: без EXPLAIN, gp_segment_id и validation partition design будет гаданием.",
          "show_commands": [
            "python3 mentor-lab.py replay greenplum --student Иван --submission submissions/query-tuning.md --pre 40 --post 85 --output artifacts/greenplum-replay.md"
          ],
          "question": "Какой missing marker мешает Lesson 02?",
          "expected_answer": "EXPLAIN, gp_segment_id, root cause, validation или residual risk.",
          "verification": "Ученик называет один evidence gap и его влияние на partitioning decision.",
          "workbook_ref": "docs/lessons/02-greenplum-partitioning/student-workbook.md",
          "homework_ref": "docs/lessons/02-greenplum-partitioning/homework.md"
        },
        {
          "stage_code": "partition-pruning",
          "slides": "4-7",
          "mentor_script": "Покажи bad/good partition key и объясни, что pruning/retention не заменяют DISTRIBUTED BY.",
          "show_commands": [
            "python3 mentor-lab.py runbook greenplum-partitioning simple",
            "docker compose -f labs/greenplum/docker-compose.yml exec -T -u gpadmin greenplum psql -U gpadmin -d mentor -f /mentor-lab/examples/lesson02-partitioning-statistics-loads.sql"
          ],
          "question": "Почему partition key не равен distribution key?",
          "expected_answer": "Partition key отсекает partitions; distribution key размещает строки по segments и влияет на joins.",
          "verification": "SQL-lab выполнен; ученик показывает EXPLAIN pruning.",
          "workbook_ref": "docs/lessons/02-greenplum-partitioning/student-workbook.md",
          "homework_ref": "docs/lessons/02-greenplum-partitioning/homework.md"
        },
        {
          "stage_code": "statistics",
          "slides": "8-10",
          "mentor_script": "Свяжи incremental load с optimizer contract: touched data должна получить свежую статистику.",
          "show_commands": [
            "ANALYZE lesson02.fact_sales_partitioned;",
            "SELECT schemaname, relname, n_live_tup, last_analyze FROM pg_stat_user_tables WHERE schemaname = 'lesson02' ORDER BY relname;"
          ],
          "question": "Почему stale statistics опасны в MPP?",
          "expected_answer": "Плохие estimates могут выбрать не тот join/Motion pattern и раздуть network exchange.",
          "verification": "Ученик показывает last_analyze и before/after EXPLAIN.",
          "workbook_ref": "docs/lessons/02-greenplum-partitioning/student-workbook.md",
          "homework_ref": "docs/lessons/02-greenplum-partitioning/homework.md"
        }
      ]
    },
    "student_mode": {
      "prep_runbook": "docs/lessons/02-greenplum-partitioning/runbooks/student-prep.md",
      "workbook": "docs/lessons/02-greenplum-partitioning/student-workbook.md",
      "homework": "docs/lessons/02-greenplum-partitioning/homework.md",
      "self_check_commands": [
        "python3 mentor-lab.py doctor",
        "python3 mentor-lab.py lesson-release greenplum-partitioning verify"
      ]
    },
    "portal_actions": {
      "start_command": "python3 mentor-lab.py portal greenplum start --session <session-dir> --portal-dir de-mentor-portal",
      "export_command": "python3 mentor-lab.py portal greenplum export --session <session-dir> --portal-dir de-mentor-portal",
      "open_command": "python3 mentor-lab.py portal greenplum open --url http://127.0.0.1:3000"
    },
    "artifacts": [
      {
        "kind": "deck",
        "path": "https://docs.google.com/presentation/d/17Ae88PoniaFU34egsFPwC0PndAOoXMze4qV1pIKQkaI/edit?usp=sharing",
        "label": "Google Slides"
      },
      {
        "kind": "sql",
        "path": "labs/greenplum/examples/lesson02-partitioning-statistics-loads.sql",
        "label": "Lesson 02 SQL-lab"
      }
    ],
    "next_lesson": {
      "code": "02-greenplum-partitioning",
      "title": "Partitioning, statistics and incremental loads in MPP",
      "path": "docs/lessons/02-greenplum-partitioning/README.md"
    }
  },
  "portal": {
    "framework": "Vue 3 + Nuxt 4 + Vite",
    "repository": "https://github.com/PaulKov/de-mentor-portal",
    "app_path": "de-mentor-portal",
    "session_env": "MENTOR_LAB_SESSION",
    "dev_command": "MENTOR_LAB_SESSION=/absolute/path/to/session.json npm run dev"
  },
  "homework_review": {
    "lesson_code": "lesson-01",
    "title": "Lesson 01 Homework Walkthrough",
    "submission_status": "not_submitted",
    "submission_path": "",
    "score": 0,
    "accepted": false,
    "rubric_items": [
      {
        "code": "fact-dimension-modeling",
        "title": "Fact/dimension modeling",
        "score": 0,
        "passed": false,
        "expected_evidence": "fact, dimension, grain",
        "mentor_prompt": "зафиксировать facts, dimensions и grain до выбора ключей",
        "conclusion_hint": "Fact/dimension modeling: нужно показать конкретный артефакт, а не только объяснение."
      },
      {
        "code": "distribution-design",
        "title": "Distribution design",
        "score": 0,
        "passed": false,
        "expected_evidence": "distribution, distributed by, join pattern, cardinality",
        "mentor_prompt": "обосновать distribution key через join pattern и cardinality",
        "conclusion_hint": "Distribution design: нужно показать конкретный артефакт, а не только объяснение."
      },
      {
        "code": "partitioning-design",
        "title": "Partitioning design",
        "score": 0,
        "passed": false,
        "expected_evidence": "partition, partition by, partition key, distribution key",
        "mentor_prompt": "развести partition key и distribution key, показать pruning workload",
        "conclusion_hint": "Partitioning design: нужно показать конкретный артефакт, а не только объяснение."
      },
      {
        "code": "storage-design",
        "title": "Storage design",
        "score": 0,
        "passed": false,
        "expected_evidence": "storage, aoco, appendoptimized, orientation=column",
        "mentor_prompt": "выбрать heap/AO/AOCO под workload и объяснить компромисс",
        "conclusion_hint": "Storage design: нужно показать конкретный артефакт, а не только объяснение."
      },
      {
        "code": "catalog-evidence",
        "title": "Catalog evidence",
        "score": 0,
        "passed": false,
        "expected_evidence": "pg_partition_tree, gp_toolkit.gp_partitions, leaf_partitions",
        "mentor_prompt": "добавить catalog evidence по partitions",
        "conclusion_hint": "Catalog evidence: нужно показать конкретный артефакт, а не только объяснение."
      },
      {
        "code": "explain-gp_segment_id-evidence",
        "title": "EXPLAIN/gp_segment_id evidence",